Назовите столицу России|Москва|Казань|Новгород|Санкт-петербург
Какая столица Татарстана?|Казань|Астана|Елабуга|Челны
Про какую летнюю погоду говорят "Ведро" ?|Сухая ясная|Прохладная дождливая|Теплая дождливая|Длительные заморозки
Какой вид березы славится красивой древесиной?|Карельская|Курильская|Корейская|Канадская
Какая поэма есть у В. В. Маяковского?|"Флейта-позвоночник"|"Свирель-губы"|"Скрипка-ладони"|"Барабан-нервы"
Одним из направлений какой религиозной философии является учение дзен?|Буддизм|Даосизм|Индуизм|Иудаизм
Как "в народе" называют химическое соединение - тринитротолуол?|Тротил|Пластид|Гексаген|Динамит
У кого из "вампиров" кровь пьют только самки?|Комары|Летучие мыши|Пиявки|Клещи
Какого зайца НЕ бывает?|Чувак|Тумак|Русак|Беляк
В русских сказках лисичка-сестричка, коза-дереза, а зайчик-... Кто?|Побегайчик|Попугайчик|Петляйчик|Обгрызайчик